<?xml version="1.0" encoding="UTF-8"?>
<?xml-stylesheet type="text/xsl" href="http://project.lsst.org/ts/sal_objects/schema/SALTelemetrySet.xsl"?>
<SALTelemetrySet xmlns:xsi="http://www.w3.org/2001/XMLSchema-instance"
	xsi:noNamespaceSchemaLocation="http://project.lsst.org/ts/sal_objects/schema/SALTelemetrySet.xsd">
<SALTelemetry>
    <Subsystem>CatchupArchiver</Subsystem>
    <Version>3.8</Version>
    <Author></Author>
    <EFDB_Topic>CatchupArchiver_sequencerHeartbeat</EFDB_Topic>
    <item>
        <EFDB_Name>name</EFDB_Name>
        <Description>Entitity name.</Description>
        <IDL_Type>string</IDL_Type>
        <IDL_Size>128</IDL_Size>
        <Units>unitless</Units>
        <Count>1</Count>
    </item>
    <item>
        <EFDB_Name>identifier</EFDB_Name>
        <Description>Entity identifier</Description>
        <IDL_Type>float</IDL_Type>
        <Units>unitless</Units>
        <Count>1</Count>
    </item>
    <item>
        <EFDB_Name>timestamp</EFDB_Name>
        <Description>Timestamp the topic was generated.</Description>
        <IDL_Type>string</IDL_Type>
        <IDL_Size>256</IDL_Size>
        <Units>unitless</Units>
        <Count>1</Count>
    </item>
</SALTelemetry></SALTelemetrySet>