<?xml version="1.0" encoding="UTF-8"?>
<?xml-stylesheet type="text/xsl" href="http://lsst-sal.tuc.noao.edu/schema/SALTelemetrySet.xsl"?>
<SALTelemetrySet xmlns:xsi="http://www.w3.org/2001/XMLSchema-instance"
	xsi:noNamespaceSchemaLocation="http://lsst-sal.tuc.noao.edu/schema/SALTelemetrySet.xsd">
<SALTelemetry>
    <Subsystem>EAS</Subsystem>
    <Version>3.8.38</Version>
    <Author></Author>
    <EFDB_Topic>EAS_timestamp</EFDB_Topic>
    <item>
        <EFDB_Name>timestamp</EFDB_Name>
        <Description>The system time (TAI).</Description>
        <IDL_Type>double</IDL_Type>
        <Units></Units>
        <Count>1</Count>
    </item>
</SALTelemetry>
<SALTelemetry>
    <Subsystem>EAS</Subsystem>
    <Version>3.8.38</Version>
    <Author></Author>
    <EFDB_Topic>EAS_loopTime</EFDB_Topic>
    <item>
        <EFDB_Name>loopTime</EFDB_Name>
        <Description>The actual loop time is milliseconds.</Description>
        <IDL_Type>double</IDL_Type>
        <Units></Units>
        <Count>1</Count>
    </item>
</SALTelemetry>
<SALTelemetry>
    <Subsystem>EAS</Subsystem>
    <Version>3.8.38</Version>
    <Author></Author>
    <EFDB_Topic>EAS_airTemperature</EFDB_Topic>
    <item>
        <EFDB_Name>airTemperature</EFDB_Name>
        <Description>Temperature from the air temperature probes inside dome.</Description>
        <IDL_Type>double</IDL_Type>
        <Units></Units>
        <Count>48</Count>
    </item>
</SALTelemetry>
<SALTelemetry>
    <Subsystem>EAS</Subsystem>
    <Version>3.8.38</Version>
    <Author></Author>
    <EFDB_Topic>EAS_surfaceTemperature</EFDB_Topic>
    <item>
        <EFDB_Name>surfaceTemperature</EFDB_Name>
        <Description>Temperature from the major thermal masses dome.</Description>
        <IDL_Type>double</IDL_Type>
        <Units></Units>
        <Count>58</Count>
    </item>
</SALTelemetry>
<SALTelemetry>
    <Subsystem>EAS</Subsystem>
    <Version>3.8.38</Version>
    <Author></Author>
    <EFDB_Topic>EAS_humidity</EFDB_Topic>
    <item>
        <EFDB_Name>humidity</EFDB_Name>
        <Description>probes measuring the water content of the air inside dome.</Description>
        <IDL_Type>double</IDL_Type>
        <Units></Units>
        <Count>5</Count>
    </item>
</SALTelemetry>
<SALTelemetry>
    <Subsystem>EAS</Subsystem>
    <Version>3.8.38</Version>
    <Author></Author>
    <EFDB_Topic>EAS_barometricPressure</EFDB_Topic>
    <item>
        <EFDB_Name>barometricPressure</EFDB_Name>
        <Description>barometric pressure from weather station outside dome.</Description>
        <IDL_Type>double</IDL_Type>
        <Units></Units>
        <Count>1</Count>
    </item>
</SALTelemetry>
<SALTelemetry>
    <Subsystem>EAS</Subsystem>
    <Version>3.8.38</Version>
    <Author></Author>
    <EFDB_Topic>EAS_airflowDynamics</EFDB_Topic>
    <item>
        <EFDB_Name>airflowDynamics</EFDB_Name>
        <Description>amount of air turbulance from 2D anemometers from inside dome.</Description>
        <IDL_Type>double</IDL_Type>
        <Units></Units>
        <Count>18</Count>
    </item>
</SALTelemetry>
<SALTelemetry>
    <Subsystem>EAS</Subsystem>
    <Version>3.8.38</Version>
    <Author></Author>
    <EFDB_Topic>EAS_bulkAirflow</EFDB_Topic>
    <item>
        <EFDB_Name>bulkAirflow</EFDB_Name>
        <Description>measurements of the bulk airflow from the HVAC and downdraft systems.</Description>
        <IDL_Type>double</IDL_Type>
        <Units></Units>
        <Count>15</Count>
    </item>
</SALTelemetry>
<SALTelemetry>
    <Subsystem>EAS</Subsystem>
    <Version>3.8.38</Version>
    <Author></Author>
    <EFDB_Topic>EAS_radioFrequencyInterference</EFDB_Topic>
    <item>
        <EFDB_Name>radioFrequencyInterference</EFDB_Name>
        <Description>spectrum analyzer show radio frequency interference inside dome.</Description>
        <IDL_Type>double</IDL_Type>
        <Units></Units>
        <Count>1</Count>
    </item>
</SALTelemetry>
<SALTelemetry>
    <Subsystem>EAS</Subsystem>
    <Version>3.8.38</Version>
    <Author></Author>
    <EFDB_Topic>EAS_currentLeakage</EFDB_Topic>
    <item>
        <EFDB_Name>currentLeakage</EFDB_Name>
        <Description>main power current leakage from ground.</Description>
        <IDL_Type>double</IDL_Type>
        <Units></Units>
        <Count>1</Count>
    </item>
</SALTelemetry>
<SALTelemetry>
    <Subsystem>EAS</Subsystem>
    <Version>3.8.38</Version>
    <Author></Author>
    <EFDB_Topic>EAS_weatherStation</EFDB_Topic>
    <item>
        <EFDB_Name>weatherStation</EFDB_Name>
        <Description>external environment monitoring (there should be more items here, but I don't know what).</Description>
        <IDL_Type>double</IDL_Type>
        <Units></Units>
        <Count>1</Count>
    </item>
</SALTelemetry>
<SALTelemetry>
    <Subsystem>EAS</Subsystem>
    <Version>3.8.38</Version>
    <Author></Author>
    <EFDB_Topic>EAS_accelrometers</EFDB_Topic>
    <item>
        <EFDB_Name>accelrometers</EFDB_Name>
        <Description>measuring vibrations inside dome.</Description>
        <IDL_Type>double</IDL_Type>
        <Units></Units>
        <Count>10</Count>
    </item>
</SALTelemetry>
<SALTelemetry>
    <Subsystem>EAS</Subsystem>
    <Version>3.8.38</Version>
    <Author></Author>
    <EFDB_Topic>EAS_interiorAcoustics</EFDB_Topic>
    <item>
        <EFDB_Name></EFDB_Name>
        <Description>current volume of noise inside dome.</Description>
        <IDL_Type>double</IDL_Type>
        <Units></Units>
        <Count>1</Count>
    </item>
</SALTelemetry>
<SALTelemetry>
    <Subsystem>EAS</Subsystem>
    <Version>3.8.38</Version>
    <Author></Author>
    <EFDB_Topic>EAS_sonicAnemometers</EFDB_Topic>
    <item>
        <EFDB_Name>sonicAnemometers</EFDB_Name>
        <Description>3D sonic anemoeters measuring air turbulence inside dome.</Description>
        <IDL_Type>double</IDL_Type>
        <Units></Units>
        <Count>12</Count>
    </item>
</SALTelemetry>
</SALTelemetrySet>
