<?xml version="1.0" encoding="UTF-8"?>
<?xml-stylesheet type="text/xsl" href="http://lsst-sal.tuc.noao.edu/schema/SALTelemetrySet.xsl"?>
<SALTelemetrySet xmlns:xsi="http://www.w3.org/2001/XMLSchema-instance"
	xsi:noNamespaceSchemaLocation="http://lsst-sal.tuc.noao.edu/schema/SALTelemetrySet.xsd">
<SALTelemetry>
    <Subsystem>calibrationElectrometer</Subsystem>
    <Version>3.7.1</Version>
    <Author></Author>
    <EFDB_Topic>calibrationElectrometer_loopTime</EFDB_Topic>
    <item>
        <EFDB_Name>loopTime</EFDB_Name>
        <Description>The actual loop time is ms.
</Description>
        <IDL_Type>double</IDL_Type>
        <Units></Units>
        <Count>1</Count>
    </item>
    <item>
        <EFDB_Name>electId</EFDB_Name>
        <Description></Description>
        <IDL_Type>string</IDL_Type>
        <IDL_Size>256</IDL_Size>
        <Units></Units>
        <Count>1</Count>
    </item>
</SALTelemetry>
<SALTelemetry>
    <Subsystem>calibrationElectrometer</Subsystem>
    <Version>3.7.1</Version>
    <Author></Author>
    <EFDB_Topic>calibrationElectrometer_timestamp</EFDB_Topic>
    <item>
        <EFDB_Name>timestamp</EFDB_Name>
        <Description>The system time (TAI).</Description>
        <IDL_Type>double</IDL_Type>
        <Units></Units>
        <Count>1</Count>
    </item>
    <item>
        <EFDB_Name>electId</EFDB_Name>
        <Description></Description>
        <IDL_Type>string</IDL_Type>
        <IDL_Size>256</IDL_Size>
        <Units></Units>
        <Count>1</Count>
    </item>
</SALTelemetry></SALTelemetrySet>