<?xml version="1.0" encoding="UTF-8"?>
<?xml-stylesheet type="text/xsl" href="http://lsst-sal.tuc.noao.edu/schema/SALTelemetrySet.xsl"?>
<SALTelemetrySet xmlns:xsi="http://www.w3.org/2001/XMLSchema-instance" xsi:noNamespaceSchemaLocation="http://lsst-sal.tuc.noao.edu/schema/SALTelemetrySet.xsd">
  <SALTelemetry>
    <Subsystem>PMD</Subsystem>
    <EFDB_Topic>PMD_position</EFDB_Topic>
    <item>
      <EFDB_Name>position</EFDB_Name>
      <Description>The position of the device.</Description>
      <IDL_Type>double</IDL_Type>
      <Units>millimeter</Units>
      <Count>1</Count>
    </item>
  </SALTelemetry>
</SALTelemetrySet>
