<?xml version="1.0" encoding="UTF-8"?>
<?xml-stylesheet type="text/xsl" href="http://lsst-sal.tuc.noao.edu/schema/SALTelemetrySet.xsl"?>
<SALTelemetrySet xmlns:xsi="http://www.w3.org/2001/XMLSchema-instance"
	xsi:noNamespaceSchemaLocation="http://lsst-sal.tuc.noao.edu/schema/SALTelemetrySet.xsd">
<SALTelemetry>
    <Subsystem>dmHeaderService</Subsystem>
    <Version>3.5.1</Version>
    <Author>aanania</Author>
    <EFDB_Topic>dmHeaderService_LoopTime_ms</EFDB_Topic>
    <item>
        <EFDB_Name>loopTime_ms</EFDB_Name>
        <Description>The actual loop time is ms.
</Description>
        <IDL_Type>double</IDL_Type>
        <Units></Units>
        <Count>1</Count>
    </item>
</SALTelemetry>
<SALTelemetry>
    <Subsystem>dmHeaderService</Subsystem>
    <Version>3.5.1</Version>
    <Author>aanania</Author>
    <EFDB_Topic>dmHeaderService_Timestamp</EFDB_Topic>
    <item>
        <EFDB_Name>timestamp</EFDB_Name>
        <Description>The system time (TAI).</Description>
        <IDL_Type>double</IDL_Type>
        <Units></Units>
        <Count>1</Count>
    </item>
</SALTelemetry></SALTelemetrySet>
