<?xml version="1.0" encoding="UTF-8"?>
<?xml-stylesheet type="text/xsl" href="http://lsst-sal.tuc.noao.edu/schema/SALTelemetrySet.xsl"?>
<SALTelemetrySet xmlns:xsi="http://www.w3.org/2001/XMLSchema-instance"
	xsi:noNamespaceSchemaLocation="http://lsst-sal.tuc.noao.edu/schema/SALTelemetrySet.xsd">
<SALTelemetry>
    <Subsystem>MTAlignment</Subsystem>
    <Version>3.7.1</Version>
    <Author>Colin Winslow</Author>
    <EFDB_Topic>MTAlignment_trackertemp</EFDB_Topic>
    <item>
        <EFDB_Name>temperature</EFDB_Name>
        <Description>current temperature reported by the tracker sensor</Description>
        <IDL_Type>double</IDL_Type>
        <Units>deg_C</Units>
        <Count>1</Count>
    </item>
</SALTelemetry>
</SALTelemetrySet>
