<?xml version="1.0" encoding="UTF-8"?>
<?xml-stylesheet type="text/xsl" href="http://lsst-sal.tuc.noao.edu/schema/SALTelemetrySet.xsl"?>
<SALTelemetrySet xmlns:xsi="http://www.w3.org/2001/XMLSchema-instance" xsi:noNamespaceSchemaLocation="http://lsst-sal.tuc.noao.edu/schema/SALTelemetrySet.xsd">
  <SALTelemetry>
    <Subsystem>IOTA</Subsystem>
    <Version>3.8.31</Version>
    <Author/>
    <EFDB_Topic>IOTA_timestamp</EFDB_Topic>
    <item>
      <EFDB_Name>timestamp</EFDB_Name>
      <Description>The system time (TAI).</Description>
      <IDL_Type>double</IDL_Type>
      <Units>second</Units>
      <Count>1</Count>
    </item>
  </SALTelemetry>
  <SALTelemetry>
    <Subsystem>IOTA</Subsystem>
    <Version>3.8.31</Version>
    <Author/>
    <EFDB_Topic>IOTA_loopTime</EFDB_Topic>
    <item>
      <EFDB_Name>loopTime</EFDB_Name>
      <Description>The actual loop time is milliseconds.</Description>
      <IDL_Type>double</IDL_Type>
      <Units>second</Units>
      <Count>1</Count>
    </item>
  </SALTelemetry>
</SALTelemetrySet>
