<?xml version="1.0" encoding="UTF-8"?>
<?xml-stylesheet type="text/xsl" href="http://lsst-sal.tuc.noao.edu/schema/SALTelemetrySet.xsl"?>
<SALTelemetrySet xmlns:xsi="http://www.w3.org/2001/XMLSchema-instance" xsi:noNamespaceSchemaLocation="http://lsst-sal.tuc.noao.edu/schema/SALTelemetrySet.xsd">
  <SALTelemetry>
    <Subsystem>AdamSensors</Subsystem>
    <Version>3.8.2</Version>
    <Description>Temperature readings from sensors connected to an ADAM-6024</Description>
    <EFDB_Topic>AdamSensors_temperature</EFDB_Topic>
    <item>
      <EFDB_Name>temp_ch0</EFDB_Name>
      <Description>Temperature reading on ADAM Analog Input 0</Description>
      <IDL_Type>float</IDL_Type>
      <Units>deg_C</Units>
      <Count>1</Count>
    </item>
    <item>
      <EFDB_Name>temp_ch1</EFDB_Name>
      <Description>Temperature reading on ADAM Analog Input 1</Description>
      <IDL_Type>float</IDL_Type>
      <Units>deg_C</Units>
      <Count>1</Count>
    </item>
    <item>
      <EFDB_Name>temp_ch2</EFDB_Name>
      <Description>Temperature reading on ADAM Analog Input 2</Description>
      <IDL_Type>float</IDL_Type>
      <Units>deg_C</Units>
      <Count>1</Count>
    </item>
    <item>
      <EFDB_Name>temp_ch3</EFDB_Name>
      <Description>Temperature reading on ADAM Analog Input 3</Description>
      <IDL_Type>float</IDL_Type>
      <Units>deg_C</Units>
      <Count>1</Count>
    </item>
    <item>
      <EFDB_Name>temp_ch4</EFDB_Name>
      <Description>Temperature reading on ADAM Analog Input 4</Description>
      <IDL_Type>float</IDL_Type>
      <Units>deg_C</Units>
      <Count>1</Count>
    </item>
    <item>
      <EFDB_Name>temp_ch5</EFDB_Name>
      <Description>Temperature reading on ADAM Analog Input 5</Description>
      <IDL_Type>float</IDL_Type>
      <Units>deg_C</Units>
      <Count>1</Count>
    </item>
  </SALTelemetry>
  <SALTelemetry>
    <Subsystem>AdamSensors</Subsystem>
    <Version>3.8.2</Version>
    <Description>Pressure readings from sensors connected to an ADAM 6024</Description>
    <EFDB_Topic>AdamSensors_pressure</EFDB_Topic>
    <item>
      <EFDB_Name>pressure_ch0</EFDB_Name>
      <Description>Pressure reading on ADAM Analog Input 0</Description>
      <IDL_Type>float</IDL_Type>
      <Units>Pa</Units>
      <Count>1</Count>
    </item>
    <item>
      <EFDB_Name>pressure_ch1</EFDB_Name>
      <Description>Pressure reading on ADAM Analog Input 1</Description>
      <IDL_Type>float</IDL_Type>
      <Units>Pa</Units>
      <Count>1</Count>
    </item>
    <item>
      <EFDB_Name>pressure_ch2</EFDB_Name>
      <Description>Pressure reading on ADAM Analog Input 2</Description>
      <IDL_Type>float</IDL_Type>
      <Units>Pa</Units>
      <Count>1</Count>
    </item>
    <item>
      <EFDB_Name>pressure_ch3</EFDB_Name>
      <Description>Pressure reading on ADAM Analog Input 3</Description>
      <IDL_Type>float</IDL_Type>
      <Units>Pa</Units>
      <Count>1</Count>
    </item>
    <item>
      <EFDB_Name>pressure_ch4</EFDB_Name>
      <Description>Pressure reading on ADAM Analog Input 4</Description>
      <IDL_Type>float</IDL_Type>
      <Units>Pa</Units>
      <Count>1</Count>
    </item>
    <item>
      <EFDB_Name>pressure_ch5</EFDB_Name>
      <Description>Pressure reading on ADAM Analog Input 5</Description>
      <IDL_Type>float</IDL_Type>
      <Units>Pa</Units>
      <Count>1</Count>
    </item>
  </SALTelemetry>
</SALTelemetrySet>
