<?xml version="1.0" encoding="UTF-8"?>
<?xml-stylesheet type="text/xsl" href="http://lsst-sal.tuc.noao.edu/schema/SALTelemetrySet.xsl"?>
<SALTelemetrySet xmlns:xsi="http://www.w3.org/2001/XMLSchema-instance" xsi:noNamespaceSchemaLocation="http://lsst-sal.tuc.noao.edu/schema/SALTelemetrySet.xsd">
  <SALTelemetry>
    <Subsystem>LinearStage</Subsystem>
    <Version>3.7.1</Version>
    <Author>ecoughlin</Author>
    <EFDB_Topic>LinearStage_position</EFDB_Topic>
    <item>
      <EFDB_Name>position</EFDB_Name>
      <Description>The position of the linear stage along the track</Description>
      <IDL_Type>float</IDL_Type>
      <Units>millimeter</Units>
      <Count>1</Count>
    </item>
  </SALTelemetry>
</SALTelemetrySet>
