<?xml version="1.0" encoding="UTF-8"?>
<?xml-stylesheet type="text/xsl" href="http://lsst-sal.tuc.noao.edu/schema/SALTelemetrySet.xsl"?>
<SALTelemetrySet xmlns:xsi="http://www.w3.org/2001/XMLSchema-instance"
	xsi:noNamespaceSchemaLocation="http://lsst-sal.tuc.noao.edu/schema/SALTelemetrySet.xsd">
<SALTelemetry>
    <Subsystem>ATBuilding</Subsystem>
    <Version>3.8.31</Version>
    <Author></Author>
    <EFDB_Topic>ATBuilding_timestamp</EFDB_Topic>
    <item>
        <EFDB_Name>timestamp</EFDB_Name>
        <Description>The system time (TAI).</Description>
        <IDL_Type>double</IDL_Type>
        <Units>unitless</Units>
        <Count>1</Count>
    </item>
</SALTelemetry>
<SALTelemetry>
    <Subsystem>ATBuilding</Subsystem>
    <Version>3.8.31</Version>
    <Author></Author>
    <EFDB_Topic>ATBuilding_loopTime</EFDB_Topic>
    <item>
        <EFDB_Name>loopTime</EFDB_Name>
        <Description>The actual loop time is milliseconds.</Description>
        <IDL_Type>double</IDL_Type>
        <Units>unitless</Units>
        <Count>1</Count>
    </item>
</SALTelemetry></SALTelemetrySet>