<?xml version="1.0" encoding="UTF-8"?>
<?xml-stylesheet type="text/xsl" href="http://project.lsst.org/ts/sal_objects/schema/SALTelemetrySet.xsl"?>
<SALTelemetrySet xmlns:xsi="http://www.w3.org/2001/XMLSchema-instance" xsi:noNamespaceSchemaLocation="http://project.lsst.org/ts/sal_objects/schema/SALTelemetrySet.xsd">
  <SALTelemetry>
    <Subsystem>PromptProcessing</Subsystem>
    <Version>3.8</Version>
    <Author/>
    <EFDB_Topic>PromptProcessing_sequencerHeartbeat</EFDB_Topic>
    <item>
      <EFDB_Name>name</EFDB_Name>
      <Description>Name of the entity to startup.</Description>
      <IDL_Type>string</IDL_Type>
      <IDL_Size>256</IDL_Size>
      <Units>unitless</Units>
      <Count>1</Count>
    </item>
    <item>
      <EFDB_Name>identifier</EFDB_Name>
      <Description>Entity identifier.</Description>
      <IDL_Type>double</IDL_Type>
      <Units>unitless</Units>
      <Count>1</Count>
    </item>
    <item>
      <EFDB_Name>timestamp</EFDB_Name>
      <Description>Timestamp the event data was generated.</Description>
      <IDL_Type>string</IDL_Type>
      <IDL_Size>256</IDL_Size>
      <Units>second</Units>
      <Count>1</Count>
    </item>
  </SALTelemetry>
</SALTelemetrySet>
