<?xml version="1.0" encoding="UTF-8"?>
<?xml-stylesheet type="text/xsl" href="http://lsst-sal.tuc.noao.edu/schema/SALTelemetrySet.xsl"?>
<SALTelemetrySet xmlns:xsi="http://www.w3.org/2001/XMLSchema-instance" xsi:noNamespaceSchemaLocation="http://lsst-sal.tuc.noao.edu/schema/SALTelemetrySet.xsd">
  <SALTelemetry>
    <Subsystem>MTAirCompressor</Subsystem>
    <EFDB_Topic>MTAirCompressor_analogData</EFDB_Topic>
    <Description>Compressor analog data.</Description>
    <item>
      <EFDB_Name>waterLevel</EFDB_Name>
      <Description>Compressor water level.</Description>
      <IDL_Type>int</IDL_Type>
      <Units>%</Units>
      <Count>1</Count>
    </item>
    <item>
      <EFDB_Name>targetSpeed</EFDB_Name>
      <Description>Compressor speed target.</Description>
      <IDL_Type>int</IDL_Type>
      <Units>RPM</Units>
      <Count>1</Count>
    </item>
    <item>
      <EFDB_Name>motorCurrent</EFDB_Name>
      <Description>Motor current.</Description>
      <IDL_Type>float</IDL_Type>
      <Units>A</Units>
      <Count>1</Count>
    </item>
    <item>
      <EFDB_Name>heatsinkTemperature</EFDB_Name>
      <Description>Heatsink temperature.</Description>
      <IDL_Type>float</IDL_Type>
      <Units>deg_C</Units>
      <Count>1</Count>
    </item>
    <item>
      <EFDB_Name>dclinkVoltage</EFDB_Name>
      <Description>DC link voltage.</Description>
      <IDL_Type>float</IDL_Type>
      <Units>V</Units>
      <Count>1</Count>
    </item>
    <item>
      <EFDB_Name>motorSpeedPercentage</EFDB_Name>
      <Description>Motor speed (%).</Description>
      <IDL_Type>float</IDL_Type>
      <Units>%</Units>
      <Count>1</Count>
    </item>
    <item>
      <EFDB_Name>motorSpeedRPM</EFDB_Name>
      <Description>Motor speed (RPM).</Description>
      <IDL_Type>int</IDL_Type>
      <Units>RPM</Units>
      <Count>1</Count>
    </item>
    <item>
      <EFDB_Name>motorInput</EFDB_Name>
      <Description>Motor powr input.</Description>
      <IDL_Type>float</IDL_Type>
      <Units>kW</Units>
      <Count>1</Count>
    </item>
    <item>
      <EFDB_Name>compressorPowerConsumption</EFDB_Name>
      <Description>Compressor power consumption.</Description>
      <IDL_Type>float</IDL_Type>
      <Units>kW</Units>
      <Count>1</Count>
    </item>
    <item>
      <EFDB_Name>compressorVolumePercentage</EFDB_Name>
      <Description>Compressor volume (%).</Description>
      <IDL_Type>int</IDL_Type>
      <Units>%</Units>
      <Count>1</Count>
    </item>
    <item>
      <EFDB_Name>compressorVolume</EFDB_Name>
      <Description>Compressor volume (m3/min).</Description>
      <IDL_Type>float</IDL_Type>
      <Units>m3/min</Units>
      <Count>1</Count>
    </item>
    <item>
      <EFDB_Name>groupVolume</EFDB_Name>
      <Description>Group volume.</Description>
      <IDL_Type>float</IDL_Type>
      <Units>m3/min</Units>
      <Count>1</Count>
    </item>
    <item>
      <EFDB_Name>stage1OutputPressure</EFDB_Name>
      <Description>Stage 1 output pressure.</Description>
      <IDL_Type>int</IDL_Type>
      <Units>mbar</Units>
      <Count>1</Count>
    </item>
    <item>
      <EFDB_Name>linePressure</EFDB_Name>
      <Description>Line pressure.</Description>
      <IDL_Type>int</IDL_Type>
      <Units>mbar</Units>
      <Count>1</Count>
    </item>
    <item>
      <EFDB_Name>stage1OutputTemperature</EFDB_Name>
      <Description>Stage 1 output temperature.</Description>
      <IDL_Type>float</IDL_Type>
      <Units>deg_C</Units>
      <Count>1</Count>
    </item>
  </SALTelemetry>
</SALTelemetrySet>
