<?xml version="1.0" encoding="UTF-8"?>
<?xml-stylesheet type="text/xsl" href="http://lsst-sal.tuc.noao.edu/schema/SALTelemetrySet.xsl"?>
<SALTelemetrySet xmlns:xsi="http://www.w3.org/2001/XMLSchema-instance" xsi:noNamespaceSchemaLocation="http://lsst-sal.tuc.noao.edu/schema/SALTelemetrySet.xsd">
  <SALTelemetry>
    <Subsystem>ESS</Subsystem>
    <EFDB_Topic>ESS_airTurbulence</EFDB_Topic>
    <Description>Air Turbulence Instrument - CSAT3B (Tri-Axial).</Description>
    <item>
      <EFDB_Name>sensorName</EFDB_Name>
      <Description>The name of the sensor.</Description>
      <IDL_Type>string</IDL_Type>
      <Units>unitless</Units>
      <Count>1</Count>
    </item>
    <item>
      <EFDB_Name>timestamp</EFDB_Name>
      <Description>Time at which the data was determined (TAI unix seconds).</Description>
      <IDL_Type>double</IDL_Type>
      <Units>second</Units>
      <Count>1</Count>
    </item>
    <item>
      <EFDB_Name>ux</EFDB_Name>
      <Description>x-axis wind speed.</Description>
      <IDL_Type>float</IDL_Type>
      <Units>m/s</Units>
      <Count>1</Count>
    </item>
    <item>
      <EFDB_Name>uy</EFDB_Name>
      <Description>y-axis wind speed.</Description>
      <IDL_Type>float</IDL_Type>
      <Units>m/s</Units>
      <Count>1</Count>
    </item>
    <item>
      <EFDB_Name>uz</EFDB_Name>
      <Description>z-axis wind speed.</Description>
      <IDL_Type>float</IDL_Type>
      <Units>m/s</Units>
      <Count>1</Count>
    </item>
    <item>
      <EFDB_Name>ts</EFDB_Name>
      <Description>Sonic temperature.</Description>
      <IDL_Type>float</IDL_Type>
      <Units>unitless</Units>
      <Count>1</Count>
    </item>
    <item>
      <EFDB_Name>diagWord</EFDB_Name>
      <Description>Diagnostic word.</Description>
      <IDL_Type>short</IDL_Type>
      <Units>unitless</Units>
      <Count>1</Count>
    </item>
    <item>
      <EFDB_Name>recordCounter</EFDB_Name>
      <Description>Record counter (0-63).</Description>
      <IDL_Type>short</IDL_Type>
      <Units>unitless</Units>
      <Count>1</Count>
    </item>
    <item>
      <EFDB_Name>location</EFDB_Name>
      <Description>The location of the sensor.</Description>
      <IDL_Type>string</IDL_Type>
      <Units>unitless</Units>
      <Count>1</Count>
    </item>
  </SALTelemetry>
  <SALTelemetry>
    <EFDB_Topic>ESS_airFlow</EFDB_Topic>
    <Description>AirFlow Sensor - Windsonic1-L (Bi-axial).</Description>
    <item>
      <EFDB_Name>sensorName</EFDB_Name>
      <Description>The name of the sensor.</Description>
      <IDL_Type>string</IDL_Type>
      <Units>unitless</Units>
      <Count>1</Count>
    </item>
    <item>
      <EFDB_Name>timestamp</EFDB_Name>
      <Description>Time at which the data was determined (TAI unix seconds).</Description>
      <IDL_Type>double</IDL_Type>
      <Units>second</Units>
      <Count>1</Count>
    </item>
    <item>
      <EFDB_Name>direction</EFDB_Name>
      <Description>Wind direction.</Description>
      <IDL_Type>short</IDL_Type>
      <Units>unitless</Units>
      <Count>1</Count>
    </item>
    <item>
      <EFDB_Name>speed</EFDB_Name>
      <Description>Wind speed.</Description>
      <IDL_Type>float</IDL_Type>
      <Units>m/s</Units>
      <Count>1</Count>
    </item>
    <item>
      <EFDB_Name>status</EFDB_Name>
      <Description>Status Code.</Description>
      <IDL_Type>unsigned short</IDL_Type>
      <Units>unitless</Units>
      <Count>1</Count>
    </item>
    <item>
      <EFDB_Name>location</EFDB_Name>
      <Description>The location of the sensor.</Description>
      <IDL_Type>string</IDL_Type>
      <Units>unitless</Units>
      <Count>1</Count>
    </item>
  </SALTelemetry>
  <SALTelemetry>
    <EFDB_Topic>ESS_temperature</EFDB_Topic>
    <Description>Temperature Sensors with up to 16 channels.</Description>
    <item>
      <EFDB_Name>sensorName</EFDB_Name>
      <Description>The name of the sensor.</Description>
      <IDL_Type>string</IDL_Type>
      <Units>unitless</Units>
      <Count>1</Count>
    </item>
    <item>
      <EFDB_Name>timestamp</EFDB_Name>
      <Description>Time at which the data was determined (TAI unix seconds).</Description>
      <IDL_Type>double</IDL_Type>
      <Units>second</Units>
      <Count>1</Count>
    </item>
    <item>
      <EFDB_Name>numChannels</EFDB_Name>
      <Description>The number of channels (minimum 1 and maximum 16).</Description>
      <IDL_Type>short</IDL_Type>
      <Units>unitless</Units>
      <Count>1</Count>
    </item>
    <item>
      <EFDB_Name>temperature</EFDB_Name>
      <Description>The temperatures.</Description>
      <IDL_Type>float</IDL_Type>
      <Units>deg_C</Units>
      <Count>16</Count>
    </item>
    <item>
      <EFDB_Name>location</EFDB_Name>
      <Description>Comma-separated string with the locations of the sensors for each channel.</Description>
      <IDL_Type>string</IDL_Type>
      <Units>unitless</Units>
      <Count>1</Count>
    </item>
  </SALTelemetry>
  <SALTelemetry>
    <EFDB_Topic>ESS_cloudRainLight</EFDB_Topic>
    <Description>Cloud Rain Light Sensors.</Description>
    <item>
      <EFDB_Name>sensorName</EFDB_Name>
      <Description>The name of the sensor.</Description>
      <IDL_Type>string</IDL_Type>
      <Units>unitless</Units>
      <Count>1</Count>
    </item>
    <item>
      <EFDB_Name>timestamp</EFDB_Name>
      <Description>Time at which the data was determined (TAI unix seconds).</Description>
      <IDL_Type>double</IDL_Type>
      <Units>second</Units>
      <Count>1</Count>
    </item>
    <item>
      <EFDB_Name>ambientTemperature</EFDB_Name>
      <Description>Ambient Temperature Sensor.</Description>
      <IDL_Type>float</IDL_Type>
      <Units>deg_C</Units>
      <Count>1</Count>
    </item>
    <item>
      <EFDB_Name>skyTemperature</EFDB_Name>
      <Description>Sky Temperature Sensor.</Description>
      <IDL_Type>float</IDL_Type>
      <Units>deg_C</Units>
      <Count>1</Count>
    </item>
    <item>
      <EFDB_Name>lightLevel</EFDB_Name>
      <Description>Light Level.</Description>
      <IDL_Type>float</IDL_Type>
      <Units>unitless</Units>
      <Count>1</Count>
    </item>
    <item>
      <EFDB_Name>rainLevel</EFDB_Name>
      <Description>Rain Level.</Description>
      <IDL_Type>float</IDL_Type>
      <Units>mm</Units>
      <Count>1</Count>
    </item>
    <item>
      <EFDB_Name>location</EFDB_Name>
      <Description>The location of the sensor.</Description>
      <IDL_Type>string</IDL_Type>
      <Units>unitless</Units>
      <Count>1</Count>
    </item>
  </SALTelemetry>
  <SALTelemetry>
    <EFDB_Topic>ESS_hx85a</EFDB_Topic>
    <Description>Omega HX85A Humidity, Temperature and Dew Point Sensor.</Description>
    <item>
      <EFDB_Name>sensorName</EFDB_Name>
      <Description>The name of the sensor.</Description>
      <IDL_Type>string</IDL_Type>
      <Units>unitless</Units>
      <Count>1</Count>
    </item>
    <item>
      <EFDB_Name>timestamp</EFDB_Name>
      <Description>Time at which the data was determined (TAI unix seconds).</Description>
      <IDL_Type>double</IDL_Type>
      <Units>second</Units>
      <Count>1</Count>
    </item>
    <item>
      <EFDB_Name>relativeHumidity</EFDB_Name>
      <Description>Relative Humidity.</Description>
      <IDL_Type>float</IDL_Type>
      <Units>%</Units>
      <Count>1</Count>
    </item>
    <item>
      <EFDB_Name>temperature</EFDB_Name>
      <Description>Air Temperature.</Description>
      <IDL_Type>float</IDL_Type>
      <Units>deg_C</Units>
      <Count>1</Count>
    </item>
    <item>
      <EFDB_Name>dewPoint</EFDB_Name>
      <Description>Dew Point.</Description>
      <IDL_Type>float</IDL_Type>
      <Units>deg_C</Units>
      <Count>1</Count>
    </item>
    <item>
      <EFDB_Name>location</EFDB_Name>
      <Description>The location of the sensor.</Description>
      <IDL_Type>string</IDL_Type>
      <Units>unitless</Units>
      <Count>1</Count>
    </item>
  </SALTelemetry>
  <SALTelemetry>
    <EFDB_Topic>ESS_hx85ba</EFDB_Topic>
    <Description>Omega HX85BA Humidity, Temperature and Pressure Sensor.</Description>
    <item>
      <EFDB_Name>sensorName</EFDB_Name>
      <Description>The name of the sensor.</Description>
      <IDL_Type>string</IDL_Type>
      <Units>unitless</Units>
      <Count>1</Count>
    </item>
    <item>
      <EFDB_Name>timestamp</EFDB_Name>
      <Description>Time at which the data was determined (TAI unix seconds).</Description>
      <IDL_Type>double</IDL_Type>
      <Units>second</Units>
      <Count>1</Count>
    </item>
    <item>
      <EFDB_Name>relativeHumidity</EFDB_Name>
      <Description>Relative Humidity.</Description>
      <IDL_Type>float</IDL_Type>
      <Units>%</Units>
      <Count>1</Count>
    </item>
    <item>
      <EFDB_Name>temperature</EFDB_Name>
      <Description>Air Temperature.</Description>
      <IDL_Type>float</IDL_Type>
      <Units>deg_C</Units>
      <Count>1</Count>
    </item>
    <item>
      <EFDB_Name>barometricPressure</EFDB_Name>
      <Description>Barometric Pressure.</Description>
      <IDL_Type>float</IDL_Type>
      <Units>mbar</Units>
      <Count>1</Count>
    </item>
    <item>
      <EFDB_Name>location</EFDB_Name>
      <Description>The location of the sensor.</Description>
      <IDL_Type>string</IDL_Type>
      <Units>unitless</Units>
      <Count>1</Count>
    </item>
  </SALTelemetry>
</SALTelemetrySet>
