<?xml version="1.0" encoding="UTF-8"?>
<?xml-stylesheet type="text/xsl" href="http://lsst-sal.tuc.noao.edu/schema/SALTelemetrySet.xsl"?>
<SALTelemetrySet xmlns:xsi="http://www.w3.org/2001/XMLSchema-instance"
	xsi:noNamespaceSchemaLocation="http://lsst-sal.tuc.noao.edu/schema/SALTelemetrySet.xsd">
<SALTelemetry>
    <Subsystem>ATWhiteLight</Subsystem>
    <Version>3.7.1</Version>
    <Author>Colin Winslow</Author>
    <EFDB_Topic>ATWhiteLight_timestamp</EFDB_Topic>
    <item>
        <EFDB_Name>timestamp</EFDB_Name>
        <Description>The system time (TAI).</Description>
        <IDL_Type>double</IDL_Type>
        <Units>seconds</Units>
        <Count>1</Count>
    </item>
</SALTelemetry>
<SALTelemetry>
    <Subsystem>ATWhiteLight</Subsystem>
    <Version>3.7.1</Version>
    <Author>Colin Winslow</Author>
    <EFDB_Topic>ATWhiteLight_loopTime</EFDB_Topic>
    <item>
        <EFDB_Name>loopTime</EFDB_Name>
        <Description>The actual loop time is milliseconds.</Description>
        <IDL_Type>double</IDL_Type>
        <Units>seconds</Units>
        <Count>1</Count>
    </item>
</SALTelemetry>
<SALTelemetry>
    <Subsystem>ATWhiteLight</Subsystem>
    <Version>3.7.1</Version>
    <Author>Colin Winslow</Author>
    <EFDB_Topic>ATWhiteLight_bulbHours</EFDB_Topic>
    <item>
        <EFDB_Name>bulbHours</EFDB_Name>
        <Description>The uptime of the WLS bulb</Description>
        <IDL_Type>double</IDL_Type>
        <Units>hours</Units>
        <Count>1</Count>
    </item>
</SALTelemetry>
<SALTelemetry>
    <Subsystem>ATWhiteLight</Subsystem>
    <Version>3.7.1</Version>
    <Author>Colin Winslow</Author>
    <EFDB_Topic>ATWhiteLight_bulbWattHours</EFDB_Topic>
    <item>
        <EFDB_Name>bulbHours</EFDB_Name>
        <Description>The uptime in watt-hours of the WLS bulb</Description>
        <IDL_Type>double</IDL_Type>
        <Units>watt hours</Units>
        <Count>1</Count>
    </item>
</SALTelemetry>
<SALTelemetry>
    <Subsystem>ATWhiteLight</Subsystem>
    <Version>3.8.2</Version>
    <Author>Colin Winslow</Author>
    <EFDB_Topic>ATWhiteLight_chillerFansSpeed</EFDB_Topic>
    <item>
        <EFDB_Name>fan1Speed</EFDB_Name>
        <Description>fan 1 speed</Description>
        <IDL_Type>long</IDL_Type>
        <Units>Hz</Units>
        <Count>1</Count>
    </item>
    <item>
        <EFDB_Name>fan2Speed</EFDB_Name>
        <Description>fan 2 speed</Description>
        <IDL_Type>long</IDL_Type>
        <Units>Hz</Units>
        <Count>1</Count>
    </item>
    <item>
        <EFDB_Name>fan3Speed</EFDB_Name>
        <Description>fan 3 speed</Description>
        <IDL_Type>long</IDL_Type>
        <Units>Hz</Units>
        <Count>1</Count>
    </item>
    <item>
        <EFDB_Name>fan4Speed</EFDB_Name>
        <Description>fan 4 speed</Description>
        <IDL_Type>long</IDL_Type>
        <Units>Hz</Units>
        <Count>1</Count>
    </item>
    <item>
        <EFDB_Name>timestamp</EFDB_Name>
        <Description>time stamp</Description>
        <IDL_Type>double</IDL_Type>
        <Units>seconds</Units>
        <Count>1</Count>
    </item>
</SALTelemetry>
<SALTelemetry>
    <Subsystem>ATWhiteLight</Subsystem>
    <Version>3.8.2</Version>
    <Author>Colin Winslow</Author>
    <EFDB_Topic>ATWhiteLight_chillerUpTime</EFDB_Topic>
    <item>
        <EFDB_Name>upTime</EFDB_Name>
        <Description>chiller uptime</Description>
        <IDL_Type>long</IDL_Type>
        <Units>Minutes</Units>
        <Count>1</Count>
    </item>
    <item>
        <EFDB_Name>timestamp</EFDB_Name>
        <Description>time stamp</Description>
        <IDL_Type>double</IDL_Type>
        <Units>seconds</Units>
        <Count>1</Count>
    </item>
</SALTelemetry>
<SALTelemetry>
    <Subsystem>ATWhiteLight</Subsystem>
    <Version>3.8.2</Version>
    <Author>Colin Winslow</Author>
    <EFDB_Topic>ATWhiteLight_chillerTempSensors</EFDB_Topic>
    <item>
        <EFDB_Name>setTemperature</EFDB_Name>
        <Description>the temperature we currently targetting</Description>
        <IDL_Type>float</IDL_Type>
        <Units>DegC</Units>
        <Count>1</Count>
    </item>
    <item>
        <EFDB_Name>supplyTemperature</EFDB_Name>
        <Description>the temperature of the coolant supply</Description>
        <IDL_Type>float</IDL_Type>
        <Units>DegC</Units>
        <Count>1</Count>
    </item>
    <item>
        <EFDB_Name>returnTemperature</EFDB_Name>
        <Description>the return temperature of coolant</Description>
        <IDL_Type>float</IDL_Type>
        <Units>DegC</Units>
        <Count>1</Count>
    </item>
    <item>
        <EFDB_Name>ambientTemperature</EFDB_Name>
        <Description>ambient temperature</Description>
        <IDL_Type>float</IDL_Type>
        <Units>DegC</Units>
        <Count>1</Count>
    </item>
    <item>
        <EFDB_Name>timestamp</EFDB_Name>
        <Description>timestamp</Description>
        <IDL_Type>double</IDL_Type>
        <Units>seconds</Units>
        <Count>1</Count>
    </item>
</SALTelemetry>
<SALTelemetry>
    <Subsystem>ATWhiteLight</Subsystem>
    <Version>3.8.2</Version>
    <Author>Colin Winslow</Author>
    <EFDB_Topic>ATWhiteLight_chillerProcessFlow</EFDB_Topic>
    <item>
        <EFDB_Name>flow</EFDB_Name>
        <Description>flow rate in liters/min</Description>
        <IDL_Type>float</IDL_Type>
        <Units>lpm</Units>
        <Count>1</Count>
    </item>
    <item>
        <EFDB_Name>timestamp</EFDB_Name>
        <Description>timestamp</Description>
        <IDL_Type>double</IDL_Type>
        <Units>seconds</Units>
        <Count>1</Count>
    </item>
</SALTelemetry>
<SALTelemetry>
    <Subsystem>ATWhiteLight</Subsystem>
    <Version>3.8.2</Version>
    <Author>Colin Winslow</Author>
    <EFDB_Topic>ATWhiteLight_chillerTECBankCurrent</EFDB_Topic>
    <item>
        <EFDB_Name>bank1Current</EFDB_Name>
        <Description>DC Amps bank 1</Description>
        <IDL_Type>float</IDL_Type>
        <Units>ADC</Units>
        <Count>1</Count>
    </item>
    <item>
        <EFDB_Name>bank2Current</EFDB_Name>
        <Description>DC Amps bank 2</Description>
        <IDL_Type>float</IDL_Type>
        <Units>ADC</Units>
        <Count>1</Count>
    </item>
    <item>
        <EFDB_Name>timestamp</EFDB_Name>
        <Description>timestamp</Description>
        <IDL_Type>double</IDL_Type>
        <Units>seconds</Units>
        <Count>1</Count>
    </item>
</SALTelemetry>
<SALTelemetry>
    <Subsystem>ATWhiteLight</Subsystem>
    <Version>3.8.2</Version>
    <Author>Colin Winslow</Author>
    <EFDB_Topic>ATWhiteLight_chillerTEDriveLevel</EFDB_Topic>
    <item>
        <EFDB_Name>chillerTEDriveLevel</EFDB_Name>
        <Description>thermo electric drive level</Description>
        <IDL_Type>float</IDL_Type>
        <Units>percent</Units>
        <Count>1</Count>
    </item>
    <item>
        <EFDB_Name>timestamp</EFDB_Name>
        <Description>timestamp</Description>
        <IDL_Type>double</IDL_Type>
        <Units>seconds</Units>
        <Count>1</Count>
    </item>
</SALTelemetry></SALTelemetrySet>
